{
  "$schema": "./contracts/gate-requirements.schema.json",
  "schemaVersion": "1.0",
  "feature": "specs/004-secure-development-hardening",
  "runId": "abaa7b81-fd2c-47e7-8d59-87a852a3b2e7",
  "owner": "Implementing agent under the active autonomous run",
  "reviewer": "Independent security and pull-request reviewer",
  "evidenceContract": "specs/004-secure-development-hardening/contracts/evidence-contract.md",
  "gates": [
    {
      "gateId": "PLAN-GATE-001",
      "applicability": "Applicable",
      "requiredScope": "Validate the completed plan phase result as immutable historical input by matching its result-file SHA-256 to the accepted run-state entry; current remediated planning state is bound by the later plan-review result.",
      "exactCommands": [
        "pwsh -NoProfile -Command '$state = Get-Content -LiteralPath specs/004-secure-development-hardening/autonomous-run-state.json -Raw -Encoding UTF8 | ConvertFrom-Json; $phase = @($state.routing.phases | Where-Object phaseId -eq \"plan\"); if ($phase.Count -ne 1 -or $phase[0].status -ne \"Completed\") { throw \"Historical plan phase is not Completed\" }; $actual = (Get-FileHash -LiteralPath $phase[0].resultPath -Algorithm SHA256).Hash.ToLowerInvariant(); if ($actual -ne $phase[0].resultSha256) { throw \"Historical plan result hash drift\" }; \"PASS: immutable historical plan result\"'"
      ],
      "requiredCommandTokens": [
        "autonomous-run-state.json",
        "phaseId -eq \"plan\"",
        "Get-FileHash",
        "immutable historical plan result"
      ],
      "requiredRunnerOrPlatformTokens": [
        "Codex",
        "frontier-reasoning",
        "codex-frontier-auto",
        "gpt-5.6-sol",
        "high",
        "macOS",
        "PowerShell 7"
      ],
      "evidencePath": ".specify/runtime/autonomous-routing/abaa7b81-fd2c-47e7-8d59-87a852a3b2e7/plan.result.json",
      "rationale": "Plan Review may remediate planning files, so the accepted plan result remains historical and must not be rewritten or misrepresented as binding the post-review bytes.",
      "reevaluationTrigger": "Any plan.md change or planning artefact/gate drift."
    },
    {
      "gateId": "PLAN-REVIEW-GATE-001",
      "applicability": "Applicable",
      "requiredScope": "Preserve the accepted plan-review phase result as immutable historical input; final Analyze binds every later minimal planning or task remediation.",
      "exactCommands": [
        "pwsh -NoProfile -Command '$state = Get-Content -LiteralPath specs/004-secure-development-hardening/autonomous-run-state.json -Raw -Encoding UTF8 | ConvertFrom-Json; $phase = @($state.routing.phases | Where-Object phaseId -eq \"plan-review\"); if ($phase.Count -ne 1 -or $phase[0].status -ne \"Completed\") { throw \"Historical plan-review phase is not Completed\" }; $actual = (Get-FileHash -LiteralPath $phase[0].resultPath -Algorithm SHA256).Hash.ToLowerInvariant(); if ($actual -ne $phase[0].resultSha256) { throw \"Historical plan-review result hash drift\" }; \"PASS: immutable historical plan-review result\"'"
      ],
      "requiredCommandTokens": [
        "autonomous-run-state.json",
        "phaseId -eq \"plan-review\"",
        "Get-FileHash",
        "immutable historical plan-review result"
      ],
      "requiredRunnerOrPlatformTokens": [
        "Codex",
        "frontier-reasoning",
        "codex-frontier-auto",
        "gpt-5.6-sol",
        "high",
        "macOS",
        "PowerShell 7"
      ],
      "evidencePath": "specs/004-secure-development-hardening/plan-review.md and .specify/runtime/autonomous-routing/abaa7b81-fd2c-47e7-8d59-87a852a3b2e7/plan-review.result.json",
      "rationale": "Analyze is explicitly allowed to make minimal planning/task remediation, so the accepted review result remains immutable historical evidence and Analyze becomes the causal binding for the final pre-implementation set.",
      "reevaluationTrigger": "Any accepted specification, plan, contract, or gate requirement change."
    },
    {
      "gateId": "GATE-REQUIREMENTS-SCHEMA-GATE-001",
      "applicability": "Applicable",
      "requiredScope": "Validate every declared gate against the feature-local JSON Schema, reject duplicate gate IDs, and require executable command plus runner/platform evidence for Applicable gates while keeping N/A gates non-executing and reasoned.",
      "exactCommands": [
        "pwsh -NoProfile -Command '$json = Get-Content -LiteralPath specs/004-secure-development-hardening/gate-requirements.json -Raw -Encoding UTF8; if (-not ($json | Test-Json -SchemaFile specs/004-secure-development-hardening/contracts/gate-requirements.schema.json)) { throw \"Gate requirements schema failed\" }; $data = $json | ConvertFrom-Json; if (@($data.gates.gateId | Sort-Object -Unique).Count -ne @($data.gates).Count) { throw \"Duplicate gateId\" }; \"PASS: gate requirements schema and unique IDs\"'"
      ],
      "requiredCommandTokens": [
        "Test-Json -SchemaFile",
        "gate-requirements.schema.json",
        "Sort-Object -Unique",
        "gate requirements schema and unique IDs"
      ],
      "requiredRunnerOrPlatformTokens": [
        "macOS",
        "PowerShell 7",
        "JSON Schema 2020-12",
        "exact HEAD"
      ],
      "evidencePath": "specs/004-secure-development-hardening/contracts/gate-requirements.schema.json, specs/004-secure-development-hardening/gate-requirements.json, and validation log",
      "rationale": "The installed autonomous validator checks only a minimal compatibility shape; the feature schema closes field, applicability, and executable-evidence gaps before Tasks.",
      "reevaluationTrigger": "Any gate requirement, gate schema, validator, command, token, runner, platform, or evidence-path change."
    },
    {
      "gateId": "TASKS-ANALYZE-GATE-001",
      "applicability": "Applicable",
      "requiredScope": "Preserve the accepted Tasks result as immutable historical input, then validate the current Analyze payload that binds all minimal final pre-implementation remediation.",
      "exactCommands": [
        "pwsh -NoProfile -Command '$state = Get-Content -LiteralPath specs/004-secure-development-hardening/autonomous-run-state.json -Raw -Encoding UTF8 | ConvertFrom-Json; $phase = @($state.routing.phases | Where-Object phaseId -eq \"tasks\"); if ($phase.Count -ne 1 -or $phase[0].status -ne \"Completed\") { throw \"Historical tasks phase is not Completed\" }; $actual = (Get-FileHash -LiteralPath $phase[0].resultPath -Algorithm SHA256).Hash.ToLowerInvariant(); if ($actual -ne $phase[0].resultSha256) { throw \"Historical tasks result hash drift\" }; \"PASS: immutable historical tasks result\"'",
        "pwsh -NoProfile -File .specify/presets/autonomous-run-governance/scripts/validate-autonomous-phase-result.ps1 -Repo . -Result .specify/runtime/autonomous-routing/abaa7b81-fd2c-47e7-8d59-87a852a3b2e7/analyze.result.json -PhaseId analyze -ExitCode 0",
        "pwsh -NoProfile -File .specify/presets/autonomous-run-governance/scripts/validate-autonomous-run-state.ps1 -State specs/004-secure-development-hardening/autonomous-run-state.json"
      ],
      "requiredCommandTokens": [
        "immutable historical tasks result",
        "Get-FileHash",
        "validate-autonomous-phase-result.ps1",
        "phaseId -eq \"tasks\"",
        "analyze.result.json",
        "validate-autonomous-run-state.ps1"
      ],
      "requiredRunnerOrPlatformTokens": [
        "Codex",
        "frontier-reasoning",
        "codex-frontier-auto",
        "gpt-5.6-sol",
        "high",
        "macOS",
        "PowerShell 7"
      ],
      "evidencePath": "specs/004-secure-development-hardening/tasks.md, specs/004-secure-development-hardening/analyze-report.md, and routed phase results",
      "rationale": "Tasks was valid when accepted; Analyze is the explicitly authorised phase for final planning/task correction and therefore supplies the current payload binding without rewriting historical phase evidence.",
      "reevaluationTrigger": "Any task, finding authorization, delivery gate, or analyze finding change."
    },
    {
      "gateId": "IDENTITY-INPUT-GATE-001",
      "applicability": "Applicable",
      "requiredScope": "Confirm branch, feature, run ID, active feature state, and the four accepted input byte hashes without editing intake, series, or run state.",
      "exactCommands": [
        "pwsh -NoProfile -File .specify/presets/autonomous-run-governance/scripts/validate-autonomous-run-state.ps1 -State specs/004-secure-development-hardening/autonomous-run-state.json",
        "pwsh -NoProfile -Command '$state = Get-Content -LiteralPath specs/004-secure-development-hardening/autonomous-run-state.json -Raw -Encoding UTF8 | ConvertFrom-Json; if ($state.runId -ne \"abaa7b81-fd2c-47e7-8d59-87a852a3b2e7\" -or $state.featurePath -ne \"specs/004-secure-development-hardening\" -or $state.branch -ne \"codex/004-secure-development-hardening\") { throw \"Feature identity mismatch\" }; foreach ($item in $state.acceptedArtifacts) { $actual = (Get-FileHash -LiteralPath $item.path -Algorithm SHA256).Hash.ToLowerInvariant(); if ($actual -ne $item.sha256) { throw \"Accepted input drift: $($item.path)\" } }; \"PASS: identity and accepted byte hashes\"'"
      ],
      "requiredCommandTokens": [
        "validate-autonomous-run-state.ps1",
        "abaa7b81-fd2c-47e7-8d59-87a852a3b2e7",
        "Get-FileHash",
        "Accepted input drift"
      ],
      "requiredRunnerOrPlatformTokens": [
        "macOS",
        "PowerShell 7",
        "autonomous-run-state schema 1.1"
      ],
      "evidencePath": "specs/004-secure-development-hardening/autonomous-run-state.json and validation log",
      "rationale": "Identity and accepted-input drift would invalidate every downstream finding, task, command, and evidence claim.",
      "reevaluationTrigger": "Every phase boundary, interruption, resume, or accepted input drift."
    },
    {
      "gateId": "ASSESSMENT-157-GATE-001",